Curation,Variable ID,Variable name,Variable synonyms,Context of use,Growth stage,Variable status,Variable Xref,Institution,Scientist,Date,Language,Crop,Trait ID,Trait name,Trait class,Trait description,Trait synonyms,Main trait abbreviation,Alternative trait abbreviations,Entity,Attribute,Trait status,Trait Xref,Method ID,Method name,Method class,Method description,Formula,Method reference,Scale ID,Scale name,Scale class,Decimal places,Lower limit,Upper limit,Scale Xref,Category 1,Category 2,Category 3,Category 4,Category 5,Category 6,Category 7,Category 8,Category 9,Category 10
,CO_330:0000223,PlGwht_Et_1to6,"HABIT, PGH",Characterizing stocks,,Recommended,,CIP,Curator,04-April-2016,EN,Potato,CO_330:0000000,Plant growth habit,Morphological trait,The growth habit of the plant,,PlGwht,,plant,growth habit,Recommended,"Gomez, R. 2004",CO_330:0000001,Visual estimation - Plant growth habit,Estimation,Observe the growth habit or shape of 10 individual plants and rate it,,"Gomez, R. 2004",CO_330:0000002,PlGwht 6 pt. scale,Ordinal,,,,"Gomez, R. 2004",3 = Decumbent,2 = Semi-erect,5 = Semi-rosette,4 = Prostrate,6 = Rosette,1 = Erect,,,,
,CO_330:0000224,Flwdgr_Et_0to7,FLOWERING,Characterizing stocks,,Recommended,,CIP,Curator,04-April-2016,EN,Potato,CO_330:0000003,Flowering degree,Morphological trait,The degree of flowering,,Flwdgr,,flower,degree,Recommended,De Haan et al. 2017,CO_330:0000004,Visual estimation - Flowering degree,Estimation,Observe the presence of flowers on the plant when it has reached maximum growth and rate it,,"Gomez, R. 2004",CO_330:0000005,Flwdgr 5 pt. scale,Ordinal,,,,"Gomez, R. 2004",3 = Flowering scarce,1 = Bud abortion,7 = Flowering profuse,5 = Flowering moderate,0 = Absent,,,,,
,CO_330:0000225,CorSh_Et_1to9,CORSHAP,Characterizing stocks,,Recommended,,CIP,Curator,4-Apr-2016,EN,Potato,CO_330:0000006,Corolla shape,Morphological trait,The shape of the corolla,,CorSh,,corolla,shape,Recommended,"Gomez, R. 2004",CO_330:0000007,Visual estimation - Corolla shape,Estimation,Observe the corolla shape in a fully open flower and rate it,,"Gomez, R. 2004",CO_330:0000008,CorSh 5 pt. scale,Ordinal,,,,"Gomez, R. 2004",5 = Pentagonal,3 = Semi-stellate,9 = Very rotate,7 = Rotate,1 = Stellate,,,,,
,CO_330:0000226,FlwNIn_Et_0to7,NIPP,Characterizing stocks,,Recommended,,CIP,Curator,4-Apr-2016,EN,Potato,CO_330:0000009,Inflorescence number,Morphological trait,The number of inflorescences,,FlwNIn,,inflorescence,number,Recommended,"Gomez, R. 2004",CO_330:0000010,Visual estimation - Inflorescence number,Counting,Count the total number of inflorescences per plant and record it,,"Gomez, R. 2004",CO_330:0000011,FlwNIn 5 pt. scale,Ordinal,,,,"Gomez, R. 2004",3 = 2-4 inflorescences,1 = 1 inflorescence,7 = 11 or more inflorescences,5 = 5-10 inflorescences,0 = Absent,,,,,
,CO_330:0000227,FlwNum_Et_1to9,NFWP,Characterizing stocks,,Recommended,,CIP,Curator,04-April-2016,EN,Potato,CO_330:0000012,Main inflorescence flower number,Morphological trait,The flower number of the main inflorescence,,FlwNum,,main inflorescence,flower,Recommended,"Gomez, R. 2004",CO_330:0000013,Visual estimation - Main inflorescence flower number,Counting,Count the total number of flowers per main inflorescence at the time of flowering and record it,,"Gomez, R. 2004",CO_330:0000014,FlwNum 6 pt. scale,Ordinal,,,,"Gomez, R. 2004",2 = Few (2 to 5),1 = Single,4 = Abundant (11 to 20),3 = Intermediate (6 to 10),5 = Very abundant (over 20),0 = Absent,,,,
,CO_330:0000228,FlrAnP_Et_1to9,ANTPIG,Characterizing stocks,,Recommended,,CIP,Curator,04-April-2016,EN,Potato,CO_330:0000015,Anther pigmentation,Morphological trait,The pigmentation of the anther,,FlrAnP,,anther,pigmentation,Recommended,"Gomez, R. 2004",CO_330:0000016,Visual estimation - Anther pigmentation,Estimation,Observe the pigmentation of the anther and rate it,,"Gomez, R. 2004",CO_330:0000017,FlrAnP 5 pt. scale,Ordinal,,,,"Gomez, R. 2004",2 = Spots on the apex,1 = Sidebands pigmented,4 = Reddish-brown anthers,3 = Apex and bands pigmented,0 = Without anthocyanins,,,,,
,CO_330:0000229,FlrPPg_Et_0to8,PISP,Characterizing stocks,,Recommended,,CIP,Curator,4-Apr-2016,EN,Potato,CO_330:0000018,Pistil pigmentation,Morphological trait,The pigmentation of the pistil,,FlrPPg,,pistil,pigmentation,Recommended,"Gomez, R. 2004",CO_330:0000019,Visual estimation - Pistil pigmentation,Estimation,Observe the pigmentation of the pistil and rate it,,"Gomez, R. 2004",CO_330:0000020,FlrPPg 9 pt. scale,Ordinal,,,,"Gomez, R. 2004",2 = Pigmented ovary(PO),1 = Pigmented stigma(PS),4 = Pigmented stigma and ovary(PS+PO),3 = Pigmented ovary inner wall (POW),6 = Pigmented ovary and ovary wall (PO+POW),5 = Pigmented stigma and ovary wall(PO+POW),8 = Pigmented stile,7 = Pigmented stigma/ovary and ovary wall(PS+PO+POW),0 = Without anthocyanins,
,CO_330:0000230,FrtShp_Et_1to7,FRUTSHP,Characterizing stocks,,Recommended,,CIP,Curator,04-April-2016,EN,Potato,CO_330:0000021,Fruit shape,Morphological trait,The shape of the fruit,,FrtShp,,fruit,shape,Recommended,"Gomez, R. 2004",CO_330:0000022,Visual estimation - Fruit shape,Estimation,Observe the shape of the fruit and rate it,,"Gomez, R. 2004",CO_330:0000023,FrtShp 7 pt. scale,Ordinal,,,,"Gomez, R. 2004",3 = Ovoid,2 = Globose with terminal mucron,5 = Conical,4 = Ovoid with terminal mucron,7 = Pyriform,6 = Long conical,1 = Globose,,,
,CO_330:0000231,FrtCol_Et_1to7,FRUIT,Characterizing stocks,,Recommended,,CIP,Curator,04-April-2016,EN,Potato,CO_330:0000024,Fruit color,Morphological trait,The color of the fruit,,FrtCol,,fruit,color,Recommended,"Gomez, R. 2004",CO_330:0000025,Visual estimation - Fruit color,Estimation,Observe the color of the fruit and rate it,,"Gomez, R. 2004",CO_330:0000026,FrtCol 7 pt. scale,Ordinal,,,,"Gomez, R. 2004",3 = Green with white stripes,2 = Green with few white spots,5 = Green with purple spots,4 = Green with abundant white spots,7 = Predominantly purple,6 = Green with purple stripes,1 = Green,,,
,CO_330:0000232,Pedcol_Et_1to8,PEDPIG,Characterizing stocks,,Recommended,,CIP,Curator,4-Apr-2016,EN,Potato,CO_330:0000027,Pedicel color,Morphological trait,The color of the pedicel,,Pedcol,,pedicel,color,Recommended,"Gomez, R. 2004",CO_330:0000028,Visual estimation - Pedicel color,Estimation,Observe the color of the pedicel and rate it,,"Gomez, R. 2004",CO_330:0000029,Pedcol 8 pt. scale,Ordinal,,,,"Gomez, R. 2004",3 = Slightly pigmented throughout,2 = Pigmented articulation only,5 = Pigmented above articulation,4 = Slightly pigmented throughout and articulation,7 = Mostly pigmented and green articulation,6 = Pigmented below articulation,8 = Completely pigmented,1 = Green,,
,CO_330:0000233,Calcol_Et_1to7,CALPIG,Characterizing stocks,,Recommended,,CIP,Curator,04-April-2016,EN,Potato,CO_330:0000030,Calyx color,Morphological trait,The color of the calyx,Calyx pigmentation,Calcol,,calyx,color,Recommended,"Gomez, R. 2004",CO_330:0000031,Visual estimation - Calyx color,Estimation,Observe the color of the calyx and rate it,,"Gomez, R. 2004",CO_330:0000032,Calcol 7 pt. scale,Ordinal,,,,"Gomez, R. 2004",3 = Green with many pigmented spots,2 = Green with few pigmented spots,5 = Pigmented with few green spots,4 = Pigmented with many green spots,7 = Purple,6 = Reddish,1 = Green,,,
,CO_330:0000234,SedPro_Et_0to5,SPBE,Characterizing stocks,,Recommended,,CIP,Curator,4-Apr-2016,EN,Potato,CO_330:0000033,Seed production per berry,Morphological trait,The number of seeds produced per berry,,SedPro,,berry,seed production,Recommended,"Gomez, R. 2004",CO_330:0000034,Visual estimation - Seed production per berry,Counting,Count the number of seeds produced per berry and record it,,"Gomez, R. 2004",CO_330:0000035,SedPro 6 pt. scale,Ordinal,,,,"Gomez, R. 2004",2 = 1 to 20 seeds per berry,1 = Seedless berry,4 = 50 to 100 seeds per berry,3 = 20 to 50 seeds per berry,5 = More than 100 seeds per berry,0 = No berries,,,,
,CO_330:0000235,FlrShp_Et_1to5,STSHAPE,Characterizing stocks,,Recommended,,CIP,Curator,04-April-2016,EN,Potato,CO_330:0000036,Stigma shape,Morphological trait,The shape of the stigma,,FlrShp,,stigma,shape,Recommended,"Gomez, R. 2004",CO_330:0000037,Visual estimation - Stigma shape,Estimation,Observe the shape of the stigma and rate it,,"Gomez, R. 2004",CO_330:0000038,FlrShp 3 pt. scale,Ordinal,,,,"Gomez, R. 2004",5 = Bilobate (split stigma),3 = Capilate,1 = Clavate (elongated),,,,,,,
,CO_330:0000236,LefShp_Et_1to3,LEATY,Characterizing stocks,,Recommended,,CIP,Curator,04-April-2016,EN,Potato,CO_330:0000039,Leaf shape,Morphological trait,The shape of the leaf,Type of leaf dissection,LefShp,,leaf,shape,Recommended,"Gomez, R. 2004",CO_330:0000040,Visual estimation - Leaf shape,Estimation,"Observe the shape of the leaf located in the middle of the main stem of the plant evaluated, and rate it",,"Gomez, R. 2004",CO_330:0000041,LefShp 3 pt. scale,Ordinal,,,,"Gomez, R. 2004",3 = Dissected leaves,2 = Lobed leaves,1 = Entire leaves,,,,,,,
,CO_330:0000237,LaLfN_Et_0to8,NPLL,Characterizing stocks,,Recommended,,CIP,Curator,04-April-2016,EN,Potato,CO_330:0000042,Primary lateral leaflet number,Morphological trait,The number of the primary lateral leaflet,,LaLfN,,primary lateral leaflet,number,Recommended,"Gomez, R. 2004",CO_330:0000043,Visual estimation - Primary lateral leaflet number,Counting,"Count the number of the primary lateral leaflet on the leaf located in the middle of the main stem of the plant evaluated, and record it",,"Gomez, R. 2004",CO_330:0000044,LaLfN 9 pt. scale,Ordinal,,,,"Gomez, R. 2004",2 = 2 pairs,1 = 1 pair,4 = 4 pairs,3 = 3 pairs,6 = 6 pairs,5 = 5 pairs,8 = 8 or more pairs,7 = 7 pairs,0 = Absent,
,CO_330:0000238,AdLfC_Et_1to9,CADSL,Characterizing stocks,,Recommended,,CIP,Curator,04-Apr-2016,EN,Potato,CO_330:0000045,Leaf adaxial surface color,Morphological trait,The color of the leaf adaxial surface,Color of the adaxial surface of leaves,AdLfC,,leaf adaxial surface,color,Recommended,"Gomez, R. 2004",CO_330:0000046,Visual estimation - Leaf adaxial surface color,Estimation,Observe the color of the leaf adaxial surface and rate it,,"Gomez, R. 2004",CO_330:0000047,AdLfC 5 pt. scale,Ordinal,,,,"Gomez, R. 2004",5 = Dark green,2 = Green,9 = Purple,7 = Very dark green,1 = Very light green,,,,,
,CO_330:0000239,AbLfC_Et_1to9,CABSL,Characterizing stocks,,Recommended,,CIP,Curator,04-April-2016,EN,Potato,CO_330:0000048,Leaf abaxial surface color,Morphological trait,The color of the leaf abaxial surface,Color of the abaxial surface of leaves,AbLfC,,leaf abaxial surface,color,Recommended,"Gomez, R. 2004",CO_330:0000049,Visual estimation - Leaf abaxial surface color,Estimation,Observe the color of the leaf abaxial surface and rate it,,"Gomez, R. 2004",CO_330:0000050,AbLfC 5 pt. scale,Ordinal,,,,"Gomez, R. 2004",5 = Dark green,2 = Green,9 = Purple,7 = Very dark green,1 = Very light green,,,,,
,CO_330:0000240,AdLfTd_Et_0to3,TDLAS,Characterizing stocks,,Recommended,,CIP,Curator,04-April-2016,EN,Potato,CO_330:0000051,Leaf adaxial surface trichome density,Morphological trait,The trichome density of the leaf adaxial surface,Trichome density on leaf adaxial surface,AdLfTd,,leaf adaxial surface,trichome density,Recommended,"Gomez, R. 2004",CO_330:0000052,Visual estimation - Leaf adaxial surface trichome density,Estimation,Observe the trichome density of the leaf adaxial surface and rate it,,"Gomez, R. 2004",CO_330:0000053,AdLfTd 4 pt. scale,Ordinal,,,,"Gomez, R. 2004",2 = Pubescent,1 = Slightly pubescent,3 = Strongly pubescent,0 = Absent or glabrous,,,,,,
,CO_330:0000241,AbLfTd_Et_0to3,TDLAS2,Characterizing stocks,,Recommended,,CIP,Curator,04-April-2016,EN,Potato,CO_330:0000054,Leaf abaxial surface trichome density,Morphological trait,The trichome density of the leaf abaxial surface,Trichome density on leaf abaxial surface,AbLfTd,,leaf abaxial surface,trichome density,Recommended,"Gomez, R. 2004",CO_330:0000055,Visual estimation - Leaf abaxial surface trichome density,Estimation,Observe the trichome density of the leaf abaxial surface and rate it,,"Gomez, R. 2004",CO_330:0000056,AbLfTd 4 pt. scale,Ordinal,,,,"Gomez, R. 2004",2 = Pubescent,1 = Slightly pubescent,3 = Strongly pubescent,0 = Absent or glabrous,,,,,,
,CO_330:0000242,ApLfSz_Et_1to7,APLSI,Characterizing stocks,,Recommended,,CIP,Curator,4-Apr-2016,EN,Potato,CO_330:0000057,Apical leaflet size,Morphological trait,The size of the apical leaflet,,ApLfSz,,apical leaflet,size,Recommended,"Gomez, R. 2004",CO_330:0000058,Visual estimation - Apical leaflet size,Measurement,Measure the size of the apical leaflet in centimeters and rate it,,"Gomez, R. 2004",CO_330:0000059,ApLfSz 4 pt. scale,Ordinal,,,,"Gomez, R. 2004",5 = Large(3 to 5cm),3 = Medium(2 to 3cm),7 = Very large (greater than 5cm),1 = Small (less than 2 cm),,,,,,
,CO_330:0000243,ApLfSh_Et_1to7,APLSH,Characterizing stocks,,Recommended,,CIP,Curator,04-April-2016,EN,Potato,CO_330:0000060,Apical leaflet shape,Morphological trait,The shape of the apical leaflet,,ApLfSh,,apical leaflet,shape,Recommended,"Gomez, R. 2004",CO_330:0000061,Visual estimation - Apical leaflet shape,Estimation,Observe the shape of the apical leaflet on the leaf located in the middle of the main stem and rate it,,"Gomez, R. 2004",CO_330:0000062,ApLfSh 7 pt. scale,Ordinal,,,,"Gomez, R. 2004",3 = Elliptic,2 = Lanceolate,5 = Ovoid,4 = Rhombic,7 = Chordate,6 = Obovoid,1 = Linear,,,
,CO_330:0000244,LaLfSh_Et_1to7,LALESH,Characterizing stocks,,Recommended,,CIP,Curator,04-April-2016,EN,Potato,CO_330:0000063,Lateral leaflet shape,Morphological trait,The shape of the lateral leaflet,,LaLfSh,,lateral leaflet,shape,Recommended,"Gomez, R. 2004",CO_330:0000064,Visual estimation - Lateral leaflet shape,Estimation,Observe the shape of the lateral leaflet and rate it,,"Gomez, R. 2004",CO_330:0000065,LaLfSh 7 pt. scale,Ordinal,,,,"Gomez, R. 2004",3 = Elliptic,2 = Lanceolate,5 = Ovoid,4 = Rhombic,7 = Chordate,6 = Obovoid,1 = Linear,,,
,CO_330:0000245,BShTLf_Et_1to7,BSHTL,Characterizing stocks,,Recommended,,CIP,Curator,04-April-2016,EN,Potato,CO_330:0000066,Base shape of the terminal leaflets,Morphological trait,The base shape of the terminal leaflet,Terminal leaflet base shape,BShTLf,,terminal leaflet,base shape,Recommended,"Gomez, R. 2004",CO_330:0000067,Visual estimation - Base shape of the terminal leaflets,Estimation,Observe the base shape of the terminal leaflet and rate it,,"Gomez, R. 2004",CO_330:0000068,BShTLf 7 pt. scale,Ordinal,,,,"Gomez, R. 2004",3 = Acute (less than 90),2 = Cuneate,5 = Rounded,4 = Obtuse (more than 90¨?),7 = Chordate,6 = Semi-chordate,1 = Decurrent,,,
,CO_330:0000246,AShTLf_Et_1to9,ASHTL,Characterizing stocks,,Recommended,,CIP,Curator,4-Apr-2016,EN,Potato,CO_330:0000069,Apex shape of the terminal leaflets,Morphological trait,The apex shape of the terminal leaflet,Terminal leaflet apex shape,AShTLf,,terminal leaflet,apex shape,Recommended,"Gomez, R. 2004",CO_330:0000070,Visual estimation - Apex shape of the terminal leaflets,Estimation,Observe the apex shape of the terminal leaflet and rate it,,"Gomez, R. 2004",CO_330:0000071,AShTLf 5 pt. scale,Ordinal,,,,"Gomez, R. 2004",5 = Acute (less than 90),3 = Acuminate (less than 45),9 = Rounded,7 = Obtuse (more than 90¨?),1 = Fusiform (less than 15),,,,,
,CO_330:0000247,MStPg_Et_1to7,STMPG,Characterizing stocks,,Recommended,,CIP,Curator,04-April-2016,EN,Potato,CO_330:0000072,Main Stem pigmentation,Morphological trait,The pigmentation of the main stem,,MStPg,,main stem,pigmentation,Recommended,"Gomez, R. 2004",CO_330:0000073,Visual estimation - Main Stem pigmentation,Estimation,Observe the pigmentation of the main stem and rate it,,"Gomez, R. 2004",CO_330:0000074,MStPg 7 pt. scale,Ordinal,,,,"Gomez, R. 2004",3 = Green with many pigmented spots,2 = Green with few pigmented spots,5 = Pigmented with few green spots,4 = Pigmented with many green spots,7 = Purple,6 = Reddish,1 = Green,,,
,CO_330:0000248,StWgSh_Et_0to3,STMWNG,Characterizing stocks,,Recommended,,CIP,Curator,04-April-2016,EN,Potato,CO_330:0000075,Wing stem shape,Morphological trait,The shape of the wing stem,,StWgSh,,wing stem,shape,Recommended,"Gomez, R. 2004",CO_330:0000076,Visual estimation - Wing stem shape,Estimation,Observe the shape of the wings in the main stem and rate it,,"Gomez, R. 2004",CO_330:0000077,StWgSh 3 pt. scale,Ordinal,,,,"Gomez, R. 2004",2 = Undulate,1 = Straight,3 = Dentate,0 = Absent,,,,,,
,CO_330:0000249,PSknCol_Et_1to9,TBSKN1,Characterizing stocks,,Recommended,,CIP,Curator,04-April-2016,EN,Potato,CO_330:0000078,Predominant tuber skin color,Morphological trait,The color of the predominant tuber skin,Tuber skin Predominant color,PSknCol,,predominant tuber skin,color,Recommended,De Haan et al. 2017,CO_330:0000079,Visual estimation - Predominant tuber skin color,Estimation,Observe the color of the predominant tuber skin and rate it,,"Gomez, R. 2004",CO_330:0000080,PrdSknCol 9 pt. scale,Ordinal,,,,"Gomez, R. 2004",3 = Orange,2 = Yellow,5 = Pink,4 = Brownish,7 = Purplish-red,6 = Red,9 = Blackish,8 = Purple,1 = White- cream,
,CO_330:0000250,SknCPI_Et_1to3,TBSKN2,Characterizing stocks,,Recommended,,CIP,Curator,4-Apr-2016,EN,Potato,CO_330:0000081,Tuber skin main color intensity,Morphological trait,The main color instensity of the tuber skin,,SknCPI,,tuber skin,main color intensity,Recommended,"Gomez, R. 2004",CO_330:0000082,Visual estimation - Tuber skin main color intensity,Estimation,Observe the main color instensity of the tuber skin and rate it,,"Gomez, R. 2004",CO_330:0000083,SknCPI 3 pt. Scale,Ordinal,,,,"Gomez, R. 2004",3 = Dark,2 = Intermediate,1 = Pale,,,,,,,
,CO_330:0000251,SknCSc_Et_0to9,TBSKN3,Characterizing stocks,,Recommended,,CIP,Curator,4-Apr-2016,EN,Potato,CO_330:0000084,Tuber skin secondary color,Morphological trait,The secondary color of the skin,,SknCSc,,tuber skin,secondary color,Recommended,"Gomez, R. 2004",CO_330:0000085,Visual estimation - Tuber skin secondary color,Estimation,Observe the secondary color of the skin and rate it,,"Gomez, R. 2004",CO_330:0000086,SknCSc 10 pt. Scale,Ordinal,,,,"Gomez, R. 2004",2 = Yellow,1 = White-cream,4 = Brownish,3 = Orange,6 = Red,5 = Pink,8 = Purple,7 = Purplish-red,9 = Blackish,0 = Absent
,CO_330:0000252,SknCScD_Et_0to7,TBSKN4,Characterizing stocks,,Recommended,,CIP,Curator,4-Apr-2016,EN,Potato,CO_330:0000087,Distribution of secondary tuber skin color,Morphological trait,The color distribution of secondary tuber skin,,SknCScD,,secondary tuber skin,color distribution,Recommended,"Gomez, R. 2004",CO_330:0000088,Visual estimation - Distribution of secondary tuber skin color,Estimation,"Observe the color distribution of secondary tuber skin in recently harvested tubers, and rate it",,"Gomez, R. 2004",CO_330:0000089,SknCScD 8 pt. Scale,Ordinal,,,,"Gomez, R. 2004",2 = In the eyebrows,1 = In the eyes,4 = Scattered areas,3 = In areas around the eyes (splashed),6 = Spots uniformly distributed (Stippled),5 = In areas around the eyes (Spectacled),7 = Spots (very few),0 = Absent,,
,CO_330:0000253,PFlshCol_Et_1to8,TBFSH1,Characterizing stocks,,Recommended,,CIP,Curator,4-Apr-2016,EN,Potato,CO_330:0000090,Predominant Tuber flesh color,Morphological trait,The color of the predominant tuber flesh,,PFlshCol,,predominant tuber flesh,color,Recommended,De Haan et al. 2017,CO_330:0000091,Visual estimation - Predominant Tuber flesh color,Estimation,Observe the color of the predominant tuber flesh and rate it,,"Gomez, R. 2004",CO_330:0000092,PrdFlshCol 8 pt. scale,Ordinal,,,,"Gomez, R. 2004",3 = Pale Yellow,2 = Cream,5 = Intense Yellow,4 = Yellow,7 = Purple,6 = Red,8 = Violet,1 = White,,
,CO_330:0000254,FlsCSc_Et_0to8,TBFSH2,Characterizing stocks,,Recommended,,CIP,Curator,04-April-2016,EN,Potato,CO_330:0000093,Tuber flesh secondary color,Morphological trait,The secondary color of the tuber flesh,,FlsCSc,,tuber flesh,secondary color,Recommended,"Gomez, R. 2004",CO_330:0000094,Visual estimation - Tuber flesh secondary color,Estimation,Observe the secondary color of the tuber flesh and rate it,,"Gomez, R. 2004",CO_330:0000095,FlsCSc 9 pt. Scale,Ordinal,,,,"Gomez, R. 2004",2 = Cream,1 = White,4 = Yellow,3 = Pale Yellow,6 = Red,5 = Intense Yellow,8 = Violet,7 = Purple,0 = Absent,
,CO_330:0000255,FlsCSD_Et_0to7,TBFSH3,Characterizing stocks,,Recommended,,CIP,Curator,04-April-2016,EN,Potato,CO_330:0000096,Distribution of secondary tuber flesh color,Morphological trait,The distribution of the secondary tuber flesh color,,FlsCSD,,secondary tuber flesh,color distribution,Recommended,"Gomez, R. 2004",CO_330:0000097,Visual estimation - Distribution of secondary tuber flesh color,Estimation,Observe the distribution of the secondary tuber flesh color and rate it,,"Gomez, R. 2004",CO_330:0000098,FlsCSD 8 pt. Scale,Ordinal,,,,"Gomez, R. 2004",2 = Scattered areas,1 = Scattered spots,4 = Broad vascular ring,3 = Narrow vascular ring,6 = All flesh except medulla,5 = Vascular ring and medulla,7 = Other (Stippled),0 = Absent,,
,CO_330:0000256,RtShp_Et_1to8,TBSHP1,Characterizing stocks,,Recommended,,CIP,Curator,04-April-2016,EN,Potato,CO_330:0000099,Tuber shape,Morphological trait,The shape of the tuber,General tuber shape,TbShp,,tuber,shape,Recommended,"Gomez, R. 2004",CO_330:0000100,Visual estimation - Tuber shape,Estimation,Observe the shape of the tuber and rate it,,"Gomez, R. 2004",CO_330:0000101,TbShp 8 pt. Scale,Ordinal,,,,"Gomez, R. 2004",3 = Ovoid,2 = Rounded,5 = Elliptical,4 = Obovoid,7 = Long-oblong,6 = Oblong,8 = Elongated,1 = Compressed,,
,CO_330:0000257,RtShp_Et_0to9,TBSHP2,Characterizing stocks,,Recommended,,CIP,Curator,04-April-2016,EN,Potato,CO_330:0000102,Unusual tuber shape,Morphological trait,The unsual shape of the tuber,,UTbShp,,tuber,unusual shape,Recommended,"Gomez, R. 2004",CO_330:0000103,Visual estimation - Unusual tuber shape,Estimation,Observe the unsual shape of the tuber and rate it,,"Gomez, R. 2004",CO_330:0000104,UTbShp 9 pt. Scale,Ordinal,,,,"Gomez, R. 2004",2 = Clavated,1 = Flattened,4 = Fusiformed,3 = Reniformed,6 = Coiled,5 = Falcate,8 = Concertina-shaped,7 = Digitated,9 = Tuberose,0 = Absent
,CO_330:0000258,DpEyTb_Et_1to9,TBSHP3,Characterizing stocks,,Recommended,,CIP,Curator,04-April-2016,EN,Potato,CO_330:0000105,Tuber depth eyes,Morphological trait,The depth of the tuber eyes,Tuber depth eyes,DpEyTb,,tuber,eyes depth,Recommended,"Gomez, R. 2004",CO_330:0000106,Visual estimation - Tuber depth eyes,Estimation,Observe the depth of the tuber eyes and rate it,,"Gomez, R. 2004",CO_330:0000107,DpEyTb 5 pt. scale,Ordinal,,,,"Gomez, R. 2004",5 = Slightly deep,3 = Shallow,9 = Very deep,7 = Deep,1 = Protruding,,,,,
,CO_330:0000259,PSpCol_Et_1to5,SPROUT1,Characterizing stocks,,Recommended,,CIP,Curator,04-April-2016,EN,Potato,CO_330:0000111,Predominant sprout color,Morphological trait,The predominant color of the sprout,Sprout predominant color,PSpCol,,sprout,predominant color,Recommended,"Gomez, R. 2004",CO_330:0000112,Visual estimation - Predominant sprout color,Estimation,Observe the predominant color of the sprout and rate it,,"Gomez, R. 2004",CO_330:0000113,PSpCol 5 pt. scale,Ordinal,,,,"Gomez, R. 2004",3 = Red,2 = Pink,5 = Violet,4 = Purple,1 = White,,,,,
,CO_330:0000260,SpScCol_Et_0to5,SPROUT2,Characterizing stocks,,Recommended,,CIP,Curator,04-April-2016,EN,Potato,CO_330:0000114,Secondary sprout color,Morphological trait,The secondary color of the sprout,Sprout secondary color,SpScCol,,sprout,secondary color,Recommended,"Gomez, R. 2004",CO_330:0000115,Visual estimation - Secondary sprout color,Estimation,Observe the secondary color of the sprout and rate it,,"Gomez, R. 2004",CO_330:0000116,SpScCol 6 pt. scale,Ordinal,,,,"Gomez, R. 2004",2 = Pink,1 = White,4 = Purple,3 = Red,5 = Violet,0 = Absent,,,,
,CO_330:0000261,SpCSD_Et_0to7,SPROUT3,Characterizing stocks,,Recommended,,CIP,Curator,04-April-2016,EN,Potato,CO_330:0000117,Distribution of secondary sprout color,Morphological trait,The secondary color distribution of the sprout,Sprout secondary color distribution,SpCSD,,sprout,secondary color distribution,Recommended,"Gomez, R. 2004",CO_330:0000118,Visual estimation - Distribution of secondary sprout color,Estimation,Observe the secondary color distribution of the sprout,,"Gomez, R. 2004",CO_330:0000119,SpCSD 7pt. scale,Ordinal,,,,"Gomez, R. 2004",2 = At the apex,1 = At the base,4 = Heavily scattered throughout,3 = Lightly scattered throughout,6 = Around bud,5 = Around bud,0 = Absent,,,
,CO_330:0000262,Pldy 5_Et_1to5,PLOIDY,Characterizing stocks,,Recommended,,CIP,Curator,04-April-2016,EN,Potato,CO_330:0000120,Ploidy,Morphological trait,The ploidy of plant,,Pldy,,plant,ploidy,Recommended,"Gomez, R. 2004",CO_330:0000121,Visual estimation - Ploidy,Counting,Count the number of chromosomes and rate it,,"Gomez, R. 2004",CO_330:0000122,Pldy 5 pt. scale,Ordinal,,,,"Gomez, R. 2004",4 = (2n = 4x = 48 Chromosomes),3 = (2n = 3x = 36 Chromosomes),6 = (2n = 6x = 72 Chromosomes),5 = (2n = 5x = 60Chromosomes),2 = (2n = 2x = 24 Chromosomes),,,,,
,CO_330:0000265,NTbPl_Ct_plplot,NTP,Evaluation in Breeding Trials,,Recommended,,CIP,Breeders,04-May-2017,EN,Potato,CO_330:0000263,Number of tubers planted,Crop research,The number of planted tubers,Plants planted number/ Planted (sett),NTbPl,,planted tuber,number,Recommended,"De Haan, S et. al 2014",CO_330:0000264,Number of tubers planted - method,Counting,Count the number of planted tubers and record it,,"De Haan, S et. al 2014",CO_330:0000219,tuber/plot,Numerical,0,0,500,"De Haan, S et. al 2014",,,,,,,,,,
,CO_330:0000268,NTbEg_Ct_plplot,NPE,Evaluation in Breeding Trials,,Recommended,,CIP,Breeders,04-May-2017,EN,Potato,CO_330:0000266,Number of emerged plants,Crop research,The number of emerged plants,Emerged plant number,NTbEg,,emerged plant,number,Recommended,"De Haan, S et. al 2014",CO_330:0000267,Number of emerged plants - method,Counting,Count the number of emerged plants and record it,,"De Haan, S et. al 2014",CO_330:0000219,tuber/plot,Numerical,0,0,500,"De Haan, S et. al 2014",,,,,,,,,,
